{
    "spec": "bakamusic-theme@2",
    "name": "mygo",
    "author": "beef-potato",
    "version": "2.0.0",
    "preview": "@/imgs/mygo.jpg",
    "description": "pic author: Bison倉鼠, https://www.pixiv.net/artworks/112236596",
    "tags": [
        "动漫"
    ],
    "scheme": "dark",
    "authorUrl": "https://github.com/beef-potato"
}
