{
    "spec": "bakamusic-theme@2",
    "name": "樱花",
    "author": "猫头猫",
    "version": "2.1.0",
    "preview": "@/imgs/preview.png",
    "description": "樱花飘落动态主题",
    "tags": [
        "动态",
        "自然",
        "季节"
    ],
    "scheme": "dark",
    "authorUrl": "https://github.com/maotoumao",
    "iframe": {
        "app": "@/iframes/app.html"
    }
}
