{
    "spec": "bakamusic-theme@2",
    "name": "爱的告白【动态】",
    "author": "akFace",
    "version": "2.1.0",
    "preview": "@/imgs/preview.jpg",
    "description": "超好看的动态主题哦，颜色会随着时间变化",
    "tags": [
        "动态",
        "抽象"
    ],
    "scheme": "light",
    "authorUrl": "https://github.com/akFace",
    "iframe": {
        "app": "@/iframes/app.html"
    }
}
