{
    "spec": "bakamusic-theme@2",
    "name": "Yamato Kancolle【动态】",
    "author": "轻舟折枝",
    "version": "2.1.1",
    "preview": "@/imgs/preview.jpg",
    "description": "Yamato Kancolle",
    "tags": [
        "动态"
    ],
    "scheme": "dark",
    "iframe": {
        "app": "@/iframes/app.html"
    }
}
