{
    "spec": "bakamusic-theme@2",
    "name": "Hacker",
    "author": "猫头猫",
    "version": "2.1.0",
    "preview": "@/imgs/preview.png",
    "description": "背景源代码：https://codesandbox.io/embed/word-rain-e4itf",
    "tags": [
        "动态",
        "赛博",
        "暗色"
    ],
    "scheme": "dark",
    "authorUrl": "https://github.com/maotoumao",
    "iframe": {
        "app": "@/iframes/app.html"
    }
}
