{
    "spec": "bakamusic-theme@2",
    "name": "赛博朋克【动态】",
    "author": "麥天浩",
    "version": "2.1.0",
    "preview": "@/imgs/preview.jpeg",
    "description": "赛博朋克，视频作者：LiveWallpapers4K（pixabay）;ID是NANOID，21位",
    "tags": [
        "动态",
        "赛博"
    ],
    "scheme": "dark",
    "authorUrl": "https://github.com/uuwor",
    "iframe": {
        "app": "@/iframes/app.html"
    }
}
