{
    "spec": "bakamusic-theme@2",
    "name": "Cute-Fluff-Ball-Critter【动态】",
    "author": "轻舟折枝",
    "version": "2.1.0",
    "preview": "@/imgs/preview.jpg",
    "description": "Cute-Fluff-Ball-Critter",
    "tags": [
        "动态"
    ],
    "scheme": "light",
    "iframe": {
        "app": "@/iframes/app.html"
    }
}
