{
    "spec": "bakamusic-theme@2",
    "name": "椿【动态】",
    "author": "akFace",
    "version": "2.1.1",
    "preview": "@/imgs/preview.jpg",
    "description": "椿",
    "tags": [
        "动态",
        "动漫"
    ],
    "scheme": "dark",
    "authorUrl": "https://github.com/akFace",
    "iframe": {
        "app": "@/iframes/app.html"
    }
}
