{
    "spec": "bakamusic-theme@2",
    "name": "言叶之庭",
    "author": "hope",
    "version": "2.1.1",
    "preview": "@/imgs/preview.jpeg",
    "description": "隐约雷鸣 阴霾天空 但盼风雨来",
    "tags": [
        "动漫",
        "影视",
        "自然"
    ],
    "scheme": "dark",
    "authorUrl": "https://github.com/Hopelsz"
}
