{
    "spec": "bakamusic-theme@2",
    "name": "gradient",
    "author": "beef-potato",
    "version": "2.1.0",
    "preview": "@/imgs/preview.png",
    "description": "渐变色主题, 自定义参数好多，眼睛看花了",
    "tags": [
        "渐变",
        "简约"
    ],
    "scheme": "light",
    "authorUrl": "https://github.com/beef-potato"
}
