{
    "spec": "bakamusic-theme@2",
    "name": "卡提希娅-风吹月影的独步【动态】",
    "author": "轻舟折枝",
    "version": "2.1.1",
    "preview": "@/imgs/preview.jpg",
    "description": "卡提希娅-风吹月影的独步",
    "tags": [
        "动态"
    ],
    "scheme": "dark",
    "iframe": {
        "app": "@/iframes/app.html"
    }
}
