{
    "spec": "bakamusic-theme@2",
    "name": "雨季",
    "author": "猫头猫",
    "version": "2.1.1",
    "preview": "@/imgs/preview.png",
    "description": "雨季动态主题",
    "tags": [
        "动态",
        "自然"
    ],
    "scheme": "dark",
    "authorUrl": "https://github.com/maotoumao",
    "iframe": {
        "app": "@/iframes/app.html"
    }
}
